{
  "$schema": "http://json-schema.org/draft-07/schema#",
  "$id": "https://codeatlas.org/schemas/file.schema.json",
  "title": "CodeAtlas File Schema",
  "description": "Schema defining a file index entry, connecting a file path to its technical and semantic roles.",
  "type": "object",
  "required": [
    "path",
    "type",
    "technical_role",
    "semantic_role",
    "features"
  ],
  "properties": {
    "path": {
      "type": "string",
      "description": "Repository-relative path of the file (e.g., 'src/components/ProjectCard.tsx')."
    },
    "type": {
      "type": "string",
      "description": "The logical type or category of file (e.g., component, hook, page, service, store, utility, style, config)."
    },
    "technical_role": {
      "type": "string",
      "description": "Technical responsibilities of this file (e.g., 'Renders individual project thumbnails with responsive padding')."
    },
    "semantic_role": {
      "type": "string",
      "description": "Human-readable semantic purpose (e.g., 'Represents a single project card in the featured and recommended collections')."
    },
    "features": {
      "type": "array",
      "description": "List of Feature IDs that this file directly supports or implements.",
      "items": {
        "type": "string",
        "pattern": "^[a-z0-9-_]+$"
      }
    },
    "imports": {
      "type": "array",
      "description": "List of files or dependencies imported by this file.",
      "items": {
        "type": "string"
      }
    },
    "imported_by": {
      "type": "array",
      "description": "List of files that import this file.",
      "items": {
        "type": "string"
      }
    },
    "dependencies": {
      "type": "array",
      "description": "External library or packages imported by this file (e.g., 'react', 'lodash').",
      "items": {
        "type": "string"
      }
    },
    "notes": {
      "type": "array",
      "description": "Developer or agent observation notes regarding code stability or patterns.",
      "items": {
        "type": "string"
      }
    }
  },
  "additionalProperties": true
}
